<urn:rula:1b193f36c53d824e5add51fbfd6da55a90834c850592ab901f3a684a39be3d4a>	Smith, W. Eugene, 1918-1978--Criticism and interpretation
<urn:rula:883e1e617aa40fbe8d0dd37b9d0b36f55820d4e06b370fe3a656fc355a379ba4>	Photojournalism--Moral and ethical aspects
<urn:rula:41d5f2fa60b634c93d3227a90a2752f6957f77284832fc1148deb76ac6a67ff2>	Documentary photography--Moral and ethical aspects
<urn:rula:b7d45d9066adac0ed99c393d27bbd63148de5d95f83e0e8b893eda97c1cb5171>	Kertész, André--Criticism and interpretation
<urn:rula:574e915ed0e980cac9d799edeaadcbe686e637666df3fdd515153f2f4bc1abd9>	Salgado, Sebastião, 1944---Criticism and interpretation
<urn:rula:54f540ac3fa7a4c43b2b433f806cf72a5154585825228259d9c8d06b3f9ab6e4>	Cartier-Bresson, Henri, 1908-2004--Criticism and interpretation
