<http://id.loc.gov/authorities/subjects/sh88000825>	Electronic apparatus and appliances--Thermal properties
<urn:rula:f4b2cbc91c874c3740128bb31309bad8d095ca3160edfc05990101a63a91906c>	Electronic apparatus and appliances--Thermal properties--Testing
<http://id.loc.gov/authorities/subjects/sh85059767>	Heat--Transmission
<http://id.loc.gov/authorities/subjects/sh85042268>	Electronic apparatus and appliances--Temperature control
<http://id.loc.gov/authorities/subjects/sh85042255>	Electronic apparatus and appliances--Cooling
<urn:rula:f44049e8471776d2211b321aba4dbf24d83fe324cb8b8d7cb9b37fb36f44ffb9>	Heat sinks (Electronic)
