<http://id.loc.gov/authorities/subjects/sh85128019>	Stereotypes (Social psychology) in advertising
<urn:rula:67e0a1426a509e21d30c5a7a85c8a32dca217a31942a8ce2ef8ca38f85c84a9a>	Social advocacy--Moral and ethical aspects--Canada
<urn:rula:8fc40a15864f5aae27fbb121aac6c6937fcb309e10f7b0f6447f837abc8a258e>	Advertising--Moral and ethical aspects--Canada
<urn:rula:3edf385774fb52605e5549a80a70ad9d7c067ccf10ca0452eb556cbb046b209b>	AIDS Committee of Toronto
<urn:rula:0126f1c5812ca5a88014b612bec03d8bc24e7495f30dc4a7cbd79df87d4194cc>	Stephen Lewis Foundation
<urn:rula:ab58dbbb6bcbed224cb9f75e80e026b9697f41333fcbbab68a4e3a8d3b60356e>	International AIDS Day 2009
<http://id.loc.gov/authorities/subjects/sh91005374>	AIDS (Disease) in mass media
