<urn:rula:7cfaf8a1b3f8a6e4892664e835791912b083b83e0b7ffd2a5435e4b5f622c5fe>	HIV-positive gay men--Sexual behavior
<http://id.loc.gov/authorities/subjects/sh2010101590>	Methamphetamine abuse--United States
<urn:rula:232c804ecf3eacb1f0ded1e7f98ac2483ee2786f78182149de40f9e07b85b936>	Sexual minorities--Drug use--United States
<urn:rula:ccfb9fa52d1317b6a0dc468e504bdf9eab044c9532bde027d186db8c7b356110>	Gay men--Drug use--United States
<http://id.loc.gov/authorities/subjects/sh2008117804>	Gay men--United States--Social conditions
<http://id.loc.gov/authorities/subjects/sh2008117805>	Gay men--Sexual behavior--United States
<urn:rula:a8b453eb18f3a3ef434c6c365546680ab2aea2667a030d753c4cdce6f96ed665>	Drugs and sex--United States
<urn:rula:ba1ab86b3e029b2e8c850e9b0df68968b7e484b80a32a0c48e8583683f751aca>	HIV-positive bisexual men--Sexual behavior
