<urn:rula:be71ac739bf60603078d6ea65b3fea1bbc8ddf061262cd269c02a6e3027e9ec7>	Cataloging of pictures--Data processing
<urn:rula:648fc0a7d98150fdf6b5a619406f91bc82a78128280f3ef503ae03064b79d507>	Harry Ransom Humanities Research Center--Photograph collections
<urn:rula:ef651f6869ecfd6c93be3f451c6f93bc2ae6b5a8e28b6fccaa382ceb67c58241>	Photograph collections--Texas--Austin
<urn:rula:52f2d8b9285c714e50cc3158ad9aea6aa3f70b47c70416a3c8890922ef64351b>	Steichen, Edward, 1879-1973--Photograph collections
<urn:rula:1b6ba2042689e5c76bf0fab62fffd58358510e7b79adc2ade669fe63e4d28743>	United States. Naval Aviation Photographic Unit
<urn:rula:8d3bc57f567d561b42a31bcef703e100bc6a65e8252f2cdd22dc5f413f966854>	War photography--United States--History--20th century
<urn:rula:90bb50b59069060ae6517f835ae73669a5ed12d6e2592f2e69389b72b5fa1b78>	United States. Navy--Aviation--History--World War, 1939-1945--Pictorial works
<urn:rula:2cf391242ffe256e8609e71a588a8f93f8ddc2930ffc4d5762ec9cbbb4ddc517>	United States. Navy--History--World War, 1939-1945--Pictorial works
<http://id.loc.gov/authorities/subjects/sh85101198>	Photographs--Conservation and restoration
