<urn:rula:c119f19692f555b866bedd9036c43fdd7711cb0607d1d014595c9b17290976ab>	Peer-to-peer architecture (Computer networks)--Security measures
<http://id.loc.gov/authorities/subjects/sh2001003097>	Peer-to-peer architecture (Computer networks)
<http://id.loc.gov/authorities/subjects/sh94001277>	Computer networks--Security measures
<http://id.loc.gov/authorities/subjects/sh2005003449>	Electronic mail systems--Security measures
<http://id.loc.gov/authorities/subjects/sh85042347>	Electronic mail systems
<http://id.loc.gov/authorities/subjects/sh94001524>	Data encryption (Computer science)
