<urn:rula:8efe80bdc628a28bd7c9f579f783e58d70fb4b9898c06033dd7dd359225dc6a9>	Nuclear power plants--Health aspects--Ontario
<http://id.loc.gov/authorities/subjects/sh2010103980>	Nuclear power plants--Health aspects
<urn:rula:effb21e354cbe5a65bd7769f7efc9f5fdf425de2f75c212bd060e4ba254b8274>	Nuclear power plants--Risk assessment--Ontario
<http://id.loc.gov/authorities/subjects/sh87002639>	Nuclear power plants--Risk assessment
<urn:rula:3d097aa2cd2ef3dcc3a34e1f8f079676ee6a7359692e8e19e8e20ba3e7b86ccd>	Nuclear energy--Environmental aspects--Ontario
<http://id.loc.gov/authorities/subjects/sh2010103932>	Nuclear energy--Environmental aspects
<urn:rula:7b7fee84a7038e218a15f82829b1838f4c1147a20f532810ba2bbc98157aa987>	Canadian Nuclear Safety Commission
