<urn:rula:35d01d308fdad42b0b1acb85c2a5a9c2ac165cae59289a7a3c423e66f2b1e149>	Police, Black--Canada--Interviews
<http://id.loc.gov/authorities/subjects/sh85104209>	Police, Black
<urn:rula:113c3ac7fb3793138a14a8357d4874e8649d40bb8682caa61c7a9e43b4c23548>	Police, Black--Canada--Social conditions
<urn:rula:5c7b78e7c09ee9f4d3b085d3439d8e0516f3f169e83c3e176dc7e995eedc87c7>	Police, Black--Canada--Social conditions--Case studies
<urn:rula:2fbf4d52791f22a600558ee738b6b8c43a1783d539667128e307d25bc955107d>	Discrimination in law enforcement--Canada
<http://id.loc.gov/authorities/subjects/sh90006097>	Discrimination in law enforcement
<urn:rula:8e62121913e84dedef7c9898cee8a34ad87acb00680237c987209776b1a178dc>	Discrimination in law enforcement--Canada--Case studies
