<http://id.loc.gov/authorities/subjects/sh85147598>	Women in popular culture
<http://id.loc.gov/authorities/subjects/sh2008117707>	Clothing and dress--Psychological aspects
<urn:rula:11633866a28bb3ee70c81ff388aaed59f5aaed7593b180360da8be3bd8263207>	Clothing and dress--Political aspects
<http://id.loc.gov/authorities/subjects/sh2008120287>	Fashion--Psychological aspects
<http://id.loc.gov/authorities/subjects/sh85027167>	Clothing and dress--Social aspects
<http://id.loc.gov/authorities/subjects/sh2008103593>	Fashion--Social aspects
<http://id.loc.gov/authorities/subjects/sh90002282>	Feminist theory
<urn:rula:295d35d4b48348daf9aea87203d4c052c336bc2f198b834329c18083fa735b77>	Online social networks--Social aspects
<urn:rula:52e9aa385ae24ef2fb75b7dfa02a200daab6cb0731011af8f09c5cb4a788b2b8>	Online social networks--Moral and ethical aspects
