<urn:rula:6b6e3c5fec594244e8248b5d2c7c8d1a6e2e57d568c6b86806a686d2ac00081e>	Church work with migrant labor--Social aspects--Ontario--Niagara region
<http://id.loc.gov/authorities/subjects/sh85025808>	Church work with migrant labor
<urn:rula:22f651c59a7779b00119a356986d41cbcd7678e2ebf7be87c48decd705b8e89d>	Church work with migrant labor--Ontario--Niagara region--Case studies
<urn:rula:9097a90ee2ce9e8902a7c2e33a6a2fd0d72a2ad6dd3afa389aac57a11d3bd7cd>	Agricultural laborers, Foreign--Social aspects
<http://id.loc.gov/authorities/subjects/sh85002347>	Agricultural laborers, Foreign
<urn:rula:51a321d21e22c1e8f5ac8d0fcfef11a169218abe804ef1fefce8b0af28be8e3c>	Agricultural laborers, Foreign--Health aspects
<urn:rula:78accbe20482014c51c5ae40b4bdd5fb93ec167660f02da440c5a1103bb4bde7>	Agricultural laborers, Foreign--Services for
<http://id.loc.gov/authorities/subjects/sh85123967>	Social isolation
